{
  "schema_version": 1,
  "instrument_key": {"country_or_market": "CN", "exchange": "SSE", "asset_type": "STOCK", "code": "600519"},
  "mode": "BACKWARD_ADJUSTED",
  "factors": [
    {"effective_date": "2026-07-15", "factor": 0.99},
    {"effective_date": "2026-07-16", "factor": 1.0}
  ],
  "source": {"provider": "desktop-engine", "retrieved_at": "2026-08-05T09:00:00+08:00"}
}
